{
  "corpus_id": "pob_game_corpus",
  "family": "keystones",
  "provenance": {
    "canonical_path": "vendor/pob/source",
    "lane_id": "pob_source_lane",
    "lock_path": "locks/pob.source.lock.json",
    "observed_commit": "143ade33da3bd0f1c803671f17930b839c79ace7",
    "pinned_commit": "143ade33da3bd0f1c803671f17930b839c79ace7",
    "pinned_ref": "refs/tags/v2.64.0",
    "repo": "PathOfBuildingCommunity/PathOfBuilding",
    "repo_url": "https://github.com/PathOfBuildingCommunity/PathOfBuilding.git",
    "source_inputs": [
      {
        "sha256": "04be9ec965b616634e02a2e2439d3f9e986d54b7b87a55b231505f15ed425925",
        "size_bytes": 2963306,
        "source_path": "vendor/pob/source/src/TreeData/3_28/tree.lua"
      }
    ],
    "tree_version": "3_28"
  },
  "record_count": 54,
  "records": [
    {
      "ascendancy_name": null,
      "class_start_index": null,
      "flavour_text": [
        "Some tasks are too important to entrust to others."
      ],
      "group_id": 0,
      "icon": "Art/2DArt/SkillIcons/passives/LoneMessenger.png",
      "incoming_node_ids": [],
      "is_ascendancy_start": false,
      "is_blighted": false,
      "is_keystone": true,
      "is_mastery": false,
      "is_notable": false,
      "is_proxy": false,
      "name": "Lone Messenger",
      "node_id": 3354,
      "orbit": 0,
      "orbit_index": 0,
      "outgoing_node_ids": [],
      "recipe": [],
      "reminder_text": [],
      "skill_id": 3354,
      "stats": [
        "You can only have one Herald\n50% more Effect of Herald Buffs on you\n100% more Damage with Hits from Herald Skills\n50% more Damage Over Time with Herald Skills\nMinions from Herald Skills deal 25% more Damage\nYour Aura Skills are Disabled"
      ]
    },
    {
      "ascendancy_name": null,
      "class_start_index": null,
      "flavour_text": [
        "Why should I dodge blows that I do not fear?"
      ],
      "group_id": 467,
      "icon": "Art/2DArt/SkillIcons/passives/KeystoneIronReflexes.png",
      "incoming_node_ids": [],
      "is_ascendancy_start": false,
      "is_blighted": false,
      "is_keystone": true,
      "is_mastery": false,
      "is_notable": false,
      "is_proxy": false,
      "name": "Iron Reflexes",
      "node_id": 10661,
      "orbit": 0,
      "orbit_index": 0,
      "outgoing_node_ids": [
        8544
      ],
      "recipe": [],
      "reminder_text": [],
      "skill_id": 10661,
      "stats": [
        "Converts all Evasion Rating to Armour. Dexterity provides no bonus to Evasion Rating"
      ]
    },
    {
      "ascendancy_name": null,
      "class_start_index": null,
      "flavour_text": [
        "My ancestral pact was sealed. Forevermore, I would gain sustenance",
        "only from the ravaged flesh of my enemies."
      ],
      "group_id": 503,
      "icon": "Art/2DArt/SkillIcons/passives/vaalpact.png",
      "incoming_node_ids": [
        20010
      ],
      "is_ascendancy_start": false,
      "is_blighted": false,
      "is_keystone": true,
      "is_mastery": false,
      "is_notable": false,
      "is_proxy": false,
      "name": "Vaal Pact",
      "node_id": 10808,
      "orbit": 0,
      "orbit_index": 0,
      "outgoing_node_ids": [],
      "recipe": [],
      "reminder_text": [],
      "skill_id": 10808,
      "stats": [
        "Life Leech from Melee Damage is Instant\nCannot Recover Life other than from Leech"
      ]
    },
    {
      "ascendancy_name": null,
      "class_start_index": null,
      "flavour_text": [
        "Invite the enemy when you are strong, evade them when you are weak;",
        "strike with the coming of the storm."
      ],
      "group_id": 663,
      "icon": "Art/2DArt/SkillIcons/passives/WindDancer.png",
      "incoming_node_ids": [],
      "is_ascendancy_start": false,
      "is_blighted": false,
      "is_keystone": true,
      "is_mastery": false,
      "is_notable": false,
      "is_proxy": false,
      "name": "Wind Dancer",
      "node_id": 11239,
      "orbit": 0,
      "orbit_index": 0,
      "outgoing_node_ids": [
        39718
      ],
      "recipe": [],
      "reminder_text": [
        "(Recently refers to the past 4 seconds)"
      ],
      "skill_id": 11239,
      "stats": [
        "20% less Attack Damage taken if you haven't been Hit by an Attack Recently\n10% more chance to Evade Attacks if you have been Hit by an Attack Recently\n20% more Attack Damage taken if you have been Hit by an Attack Recently"
      ]
    },
    {
      "ascendancy_name": null,
      "class_start_index": null,
      "flavour_text": [
        "Give up everything in pursuit of greatness - even life itself."
      ],
      "group_id": 670,
      "icon": "Art/2DArt/SkillIcons/passives/KeystoneChaosInoculation.png",
      "incoming_node_ids": [
        60440
      ],
      "is_ascendancy_start": false,
      "is_blighted": false,
      "is_keystone": true,
      "is_mastery": false,
      "is_notable": false,
      "is_proxy": false,
      "name": "Chaos Inoculation",
      "node_id": 11455,
      "orbit": 0,
      "orbit_index": 0,
      "outgoing_node_ids": [],
      "recipe": [],
      "reminder_text": [],
      "skill_id": 11455,
      "stats": [
        "Maximum Life becomes 1, Immune to Chaos Damage"
      ]
    },
    {
      "ascendancy_name": null,
      "class_start_index": null,
      "flavour_text": [
        "Legend tells of bows so powerful that only giants could draw them back."
      ],
      "group_id": 383,
      "icon": "Art/2DArt/SkillIcons/passives/KeystoneIronGrip.png",
      "incoming_node_ids": [
        46578
      ],
      "is_ascendancy_start": false,
      "is_blighted": false,
      "is_keystone": true,
      "is_mastery": false,
      "is_notable": false,
      "is_proxy": false,
      "name": "Iron Grip",
      "node_id": 12926,
      "orbit": 0,
      "orbit_index": 0,
      "outgoing_node_ids": [],
      "recipe": [],
      "reminder_text": [],
      "skill_id": 12926,
      "stats": [
        "Strength's Damage bonus applies to Projectile Attack Damage as well as Melee Damage"
      ]
    },
    {
      "ascendancy_name": null,
      "class_start_index": null,
      "flavour_text": [
        "All are invited to his feast, one way or another."
      ],
      "group_id": 0,
      "icon": "Art/2DArt/SkillIcons/passives/DiscipleOfKitava.png",
      "incoming_node_ids": [],
      "is_ascendancy_start": false,
      "is_blighted": false,
      "is_keystone": true,
      "is_mastery": false,
      "is_notable": false,
      "is_proxy": false,
      "name": "Disciple of Kitava",
      "node_id": 12953,
      "orbit": 0,
      "orbit_index": 0,
      "outgoing_node_ids": [],
      "recipe": [],
      "reminder_text": [
        "(Recently refers to the past 4 seconds)"
      ],
      "skill_id": 12953,
      "stats": [
        "Every second, Consume a nearby Corpse to Recover 5% of Life and Mana\n10% more Damage taken if you haven't Consumed a Corpse Recently"
      ]
    },
    {
      "ascendancy_name": null,
      "class_start_index": null,
      "flavour_text": [
        "Tainted blood is a gift that must be shared."
      ],
      "group_id": 526,
      "icon": "Art/2DArt/SkillIcons/passives/TinctureKeystone1.png",
      "incoming_node_ids": [
        56589
      ],
      "is_ascendancy_start": false,
      "is_blighted": false,
      "is_keystone": true,
      "is_mastery": false,
      "is_notable": false,
      "is_proxy": false,
      "name": "Bloodsoaked Blade",
      "node_id": 13019,
      "orbit": 0,
      "orbit_index": 0,
      "outgoing_node_ids": [],
      "recipe": [],
      "reminder_text": [
        "(Weeping Wounds cause you to lose 1% of your maximum Life per second per stack. Tinctures deactivate when you have 1 life remaining)"
      ],
      "skill_id": 13019,
      "stats": [
        "Tinctures inflict Weeping Wounds instead of Mana Burn\nEffects that interact with Mana Burn interact with Weeping Wounds instead"
      ]
    },
    {
      "ascendancy_name": null,
      "class_start_index": null,
      "flavour_text": [
        "My blade sings so sweetly, your body cannot help but weep."
      ],
      "group_id": 344,
      "icon": "Art/2DArt/SkillIcons/passives/CrimsonDance.png",
      "incoming_node_ids": [
        6741
      ],
      "is_ascendancy_start": false,
      "is_blighted": false,
      "is_keystone": true,
      "is_mastery": false,
      "is_notable": false,
      "is_proxy": false,
      "name": "Crimson Dance",
      "node_id": 17818,
      "orbit": 0,
      "orbit_index": 0,
      "outgoing_node_ids": [],
      "recipe": [],
      "reminder_text": [],
      "skill_id": 17818,
      "stats": [
        "You can inflict Bleeding on an Enemy up to 8 times\nYour Bleeding does not deal extra Damage while the Enemy is moving and cannot be Aggravated\n50% less Damage with Bleeding"
      ]
    },
    {
      "ascendancy_name": null,
      "class_start_index": null,
      "flavour_text": [
        "Even in death, they have their uses. They just need a little encouragement."
      ],
      "group_id": 479,
      "icon": "Art/2DArt/SkillIcons/passives/KeystoneMinionInstability.png",
      "incoming_node_ids": [],
      "is_ascendancy_start": false,
      "is_blighted": false,
      "is_keystone": true,
      "is_mastery": false,
      "is_notable": false,
      "is_proxy": false,
      "name": "Minion Instability",
      "node_id": 18663,
      "orbit": 0,
      "orbit_index": 0,
      "outgoing_node_ids": [
        38176
      ],
      "recipe": [],
      "reminder_text": [],
      "skill_id": 18663,
      "stats": [
        "Minions Explode when reduced to Low Life, dealing 33% of their Life as Fire Damage to surrounding Enemies"
      ]
    },
    {
      "ascendancy_name": null,
      "class_start_index": null,
      "flavour_text": [
        "Put your faith in intellect rather than mysticism."
      ],
      "group_id": 93,
      "icon": "Art/2DArt/SkillIcons/passives/MiracleMaker.png",